{"anchor":{"anchored_at":8,"canonical_format":"lfv-canonical-json-v1","commitment":{"algorithm":"sha256","digest":"43a2bdf4367045d235a0394bbf78e5bd50743065b6f9abbb4f5f283a0da8503f","schema_id":"lfv-search-ledger-entry-v1"},"entry_count":1,"evidence_id":"local-development:43a2bdf4367045d235a0394bbf78e5bd50743065b6f9abbb4f5f283a0da8503f","provider":"local-development","schema_version":"lfv-ledger-anchor-v1"},"artifacts":{"code":{"canonical_format":"lfv-canonical-json-v1","files":[{"content_digest":{"algorithm":"sha256","digest":"ba269e60c7d8fe12b908f819c0bd702714bafe358b2ab68b8f57a1271c0bf85c"},"path":"strategy.py","size":1147}],"ref":{"algorithm":"sha256","digest":"4eeb92613700001b56b9d5761431ae4bc888bce87e62017d26436292122f84b8","schema_id":"lfv-code-tree-v1"},"serialized_size":162},"datasets":[{"artifact":{"canonical_format":"lfv-canonical-json-v1","raw_file":{"content_digest":{"algorithm":"sha256","digest":"7b3ac4d20806961cd39b7fb3a30fab614609c0dc7ea98ffbbb96b2466d8683ee"},"path":"prices.csv","size":71},"ref":{"algorithm":"sha256","digest":"1c8d31fd74d11487c0c5a216d016fd0af397f4425f6a2e3bacc414bdb3c3552c","schema_id":"lfv-dataset-file-v1"},"serialized_size":178,"source":"prices.csv"},"available_at":5,"id":"prices","observed_at":4}],"environment":{"canonical_format":"lfv-canonical-json-v1","ref":{"algorithm":"sha256","digest":"9ce0b5e439228ce48097e1f45644a2d8b7c7562572421d33c215aac46eb08d4b","schema_id":"lfv-environment-json-v1"},"serialized_size":77,"source":"environment.json"},"features":[{"artifact":{"canonical_format":"lfv-canonical-json-v1","ref":{"algorithm":"sha256","digest":"120d8357dcb073c6ea08cc5cb0ac750dfa840e9495da9c274e118b8622c1d186","schema_id":"lfv-feature-json-v1"},"serialized_size":251},"code_hash":"4eeb92613700001b56b9d5761431ae4bc888bce87e62017d26436292122f84b8","generated_at":6,"input_hashes":["1c8d31fd74d11487c0c5a216d016fd0af397f4425f6a2e3bacc414bdb3c3552c"],"inputs":["dataset:prices"],"name":"momentum","pointer":"/features/momentum"}],"parameters":{"canonical_format":"lfv-canonical-json-v1","ref":{"algorithm":"sha256","digest":"8d0b6485f84760c8836f4983710a2219bd90a8b6788d0a2fcdd850ad4aa991a3","schema_id":"lfv-parameters-json-v1"},"serialized_size":30,"source":"parameters.json"},"result":{"canonical_format":"lfv-canonical-json-v1","ref":{"algorithm":"sha256","digest":"ea8ea9708097794c157a349e9d09fc1726ef5d47b8f997ebca417ada38cd2058","schema_id":"lfv-result-json-v1"},"serialized_size":76}},"bundle_digest":{"algorithm":"sha256","digest":"c5a99f0a6cfc6b8caab199b9870c9d070cecbf1ac3c68d0764f2e7d70829ca4f","schema_id":"lfv-proof-carrying-backtest-bundle-digest-v1"},"canonical_format":"lfv-canonical-json-v1","claim":{"metric_name":"net-alpha-bps","metric_value":400,"result_hash":"ea8ea9708097794c157a349e9d09fc1726ef5d47b8f997ebca417ada38cd2058"},"decision":{"dataset_ids":["prices"],"datasets":[{"available_at":5,"content_hash":"1c8d31fd74d11487c0c5a216d016fd0af397f4425f6a2e3bacc414bdb3c3552c","id":"prices","observed_at":4}],"decision_time":10,"feature_names":["momentum"],"features":[{"code_hash":"4eeb92613700001b56b9d5761431ae4bc888bce87e62017d26436292122f84b8","generated_at":6,"input_hashes":["1c8d31fd74d11487c0c5a216d016fd0af397f4425f6a2e3bacc414bdb3c3552c"],"name":"momentum","output_hash":"120d8357dcb073c6ea08cc5cb0ac750dfa840e9495da9c274e118b8622c1d186"}],"parameter_hash":"8d0b6485f84760c8836f4983710a2219bd90a8b6788d0a2fcdd850ad4aa991a3","strategy_id":"momentum-v1"},"execution":{"argv":["{python}","strategy.py","prices.csv","parameters.json"],"return_code":0,"stderr":""},"experiment":{"hash_algorithm":"sha256","lean_namespace":"LeanFinance.Generated.ReferenceAdapter","name":"reference-momentum-backtest"},"ledger":{"canonical_format":"lfv-canonical-json-v1","entries":[{"code":{"algorithm":"sha256","digest":"4eeb92613700001b56b9d5761431ae4bc888bce87e62017d26436292122f84b8","schema_id":"lfv-code-tree-v1"},"commitment":{"algorithm":"sha256","digest":"43a2bdf4367045d235a0394bbf78e5bd50743065b6f9abbb4f5f283a0da8503f","schema_id":"lfv-search-ledger-entry-v1"},"hypothesis_id":"momentum-v1","parameters":{"algorithm":"sha256","digest":"8d0b6485f84760c8836f4983710a2219bd90a8b6788d0a2fcdd850ad4aa991a3","schema_id":"lfv-parameters-json-v1"},"previous_commitment":null,"registered_at":7}],"schema_version":"lfv-search-ledger-v1"},"schema_version":"lfv-proof-carrying-backtest-bundle-v1","selected_trial_index":0}